{
  "id": "wide-legged-forward-fold",
  "englishNameKeys": {
    "enGB": "yoga.pose.wide_legged_forward_fold.english",
    "uk": "yoga.pose.wide_legged_forward_fold.english"
  },
  "sanskritNameKeys": {
    "enGB": "yoga.pose.wide_legged_forward_fold.sanskrit",
    "uk": "yoga.pose.wide_legged_forward_fold.sanskrit"
  },
  "family": "forward_fold",
  "level": "beginner",
  "primaryMuscles": [
    "hamstrings",
    "adductors"
  ],
  "secondaryMuscles": [
    "erector_spinae"
  ],
  "equipment": [
    "yoga_mat",
    "yoga_block",
    "bodyweight"
  ],
  "technique": [
    "Enter Wide-legged forward fold with steady footing and an even pelvis; lengthen the spine without forcing end range.",
    "Distribute load through the feet or support points; soften the jaw and keep the neck long."
  ],
  "cues": [
    "Breathe steadily; ease out of the shape if sharp pain appears.",
    "Use blocks or a strap to keep joints stacked and comfortable."
  ],
  "breathing": "Inhale to lengthen; exhale to settle into the shape without collapsing.",
  "safetyNotes": [
    "Move within a comfortable range; props are encouraged rather than forcing depth.",
    "Stop and rest if you feel dizziness, numbness, or joint locking."
  ],
  "contraindicationNotes": [
    "General safety: seek clinician guidance for recent injury, uncontrolled hypertension, or acute illness before practising."
  ],
  "evidenceEntryIds": [
    "garber-acsm-2011",
    "acsm-rt-2026"
  ],
  "holdSecondsDefault": 40,
  "unilateral": false,
  "bundled": true,
  "aliases": [],
  "tags": [
    "yoga",
    "forward_fold",
    "beginner"
  ]
}
