{
  "id": "eagle-pose",
  "englishNameKeys": {
    "enGB": "yoga.pose.eagle_pose.english",
    "uk": "yoga.pose.eagle_pose.english"
  },
  "sanskritNameKeys": {
    "enGB": "yoga.pose.eagle_pose.sanskrit",
    "uk": "yoga.pose.eagle_pose.sanskrit"
  },
  "family": "balance",
  "level": "intermediate",
  "primaryMuscles": [
    "gluteus_medius",
    "adductors"
  ],
  "secondaryMuscles": [
    "trapezius",
    "rear_deltoid"
  ],
  "equipment": [
    "yoga_mat",
    "bodyweight"
  ],
  "technique": [
    "Enter Eagle pose with steady footing and an even pelvis; lengthen the spine without forcing end range.",
    "Distribute load through the feet or support points; soften the jaw and keep the neck long."
  ],
  "cues": [
    "Breathe steadily; ease out of the shape if sharp pain appears.",
    "Use blocks or a strap to keep joints stacked and comfortable."
  ],
  "breathing": "Inhale to lengthen; exhale to settle into the shape without collapsing.",
  "safetyNotes": [
    "Move within a comfortable range; props are encouraged rather than forcing depth.",
    "Stop and rest if you feel dizziness, numbness, or joint locking."
  ],
  "contraindicationNotes": [
    "General safety: seek clinician guidance for recent injury, uncontrolled hypertension, or acute illness before practising."
  ],
  "evidenceEntryIds": [
    "garber-acsm-2011",
    "acsm-rt-2026"
  ],
  "holdSecondsDefault": 25,
  "unilateral": true,
  "bundled": true,
  "aliases": [],
  "tags": [
    "yoga",
    "balance",
    "intermediate"
  ]
}
