{
  "id": "supine-twist",
  "englishNameKeys": {
    "enGB": "yoga.pose.supine_twist.english",
    "uk": "yoga.pose.supine_twist.english"
  },
  "sanskritNameKeys": {
    "enGB": "yoga.pose.supine_twist.sanskrit",
    "uk": "yoga.pose.supine_twist.sanskrit"
  },
  "family": "twist",
  "level": "beginner",
  "primaryMuscles": [
    "obliques"
  ],
  "secondaryMuscles": [
    "gluteus_medius",
    "erector_spinae"
  ],
  "equipment": [
    "yoga_mat",
    "bodyweight"
  ],
  "technique": [
    "Enter Supine twist with steady footing and an even pelvis; lengthen the spine without forcing end range.",
    "Distribute load through the feet or support points; soften the jaw and keep the neck long."
  ],
  "cues": [
    "Breathe steadily; ease out of the shape if sharp pain appears.",
    "Use blocks or a strap to keep joints stacked and comfortable."
  ],
  "breathing": "Inhale to lengthen; exhale to settle into the shape without collapsing.",
  "safetyNotes": [
    "Move within a comfortable range; props are encouraged rather than forcing depth.",
    "Stop and rest if you feel dizziness, numbness, or joint locking."
  ],
  "contraindicationNotes": [
    "General safety: seek clinician guidance for recent injury, uncontrolled hypertension, or acute illness before practising.",
    "General safety: keep twists gentle after abdominal surgery or during later pregnancy unless cleared by a qualified professional."
  ],
  "evidenceEntryIds": [
    "garber_acsm_quantity_2011",
    "acsm_resistance_training_2026"
  ],
  "holdSecondsDefault": 45,
  "unilateral": true,
  "bundled": true,
  "aliases": [],
  "tags": [
    "yoga",
    "twist",
    "beginner"
  ]
}
